{
  "domain": "navigation-standard-gap",
  "version": 2,
  "organizations": [
    {
      "org_id": "org-alpha",
      "name": "甲国 A 港航标处",
      "country_code": "CN"
    },
    {
      "org_id": "org-beta",
      "name": "甲国 B 海区航标站",
      "country_code": "CN"
    },
    {
      "org_id": "org-gamma",
      "name": "乙国 C 港务航标局",
      "country_code": "XY"
    },
    {
      "org_id": "org-delta",
      "name": "乙国 D 湾航标队",
      "country_code": "XY"
    }
  ],
  "clauses": [
    {
      "clause_id": "IALA-G1151-3.2",
      "standard": "IALA G1151",
      "title": "风险等级与剩余风险术语",
      "source_text": "The authority shall use residual risk levels consistently in notification and escalation.",
      "official_translation": {
        "current_version": "V2",
        "versions": [
          {
            "version": "V1",
            "date": "2022-06-01",
            "text": "主管机关应在通报与升级中统一使用风险等级术语。",
            "errata": "初版官方译文，无勘误"
          },
          {
            "version": "V2",
            "date": "2026-03-01",
            "text": "主管机关应在通报与升级中统一使用剩余风险等级术语。",
            "errata": "勘误：将“风险等级”明确为“剩余风险等级”，避免与初始风险混用"
          }
        ]
      },
      "national_rule_ids": []
    },
    {
      "clause_id": "IALA-G1151-4.1",
      "standard": "IALA G1151",
      "title": "告警分级与抑制",
      "source_text": "Alerts shall be graded before suppression; misreport rate shall be monitored.",
      "official_translation": {
        "current_version": "V1",
        "versions": [
          {
            "version": "V1",
            "date": "2022-06-01",
            "text": "告警抑制前应先分级，并监测误报率。",
            "errata": "初版官方译文，无勘误"
          }
        ]
      },
      "national_rule_ids": [
        "CN-海标-2024-07"
      ]
    },
    {
      "clause_id": "IALA-G1151-5.3",
      "standard": "IALA G1151",
      "title": "导助航应急恢复时限",
      "source_text": "Temporary aids shall be deployed and navigational warnings issued within four hours.",
      "official_translation": {
        "current_version": "V2",
        "versions": [
          {
            "version": "V2",
            "date": "2023-09-01",
            "text": "应在四小时内布设临时标志并发布航行警告。",
            "errata": "初版官方译文，无勘误"
          }
        ]
      },
      "national_rule_ids": []
    }
  ],
  "gaps": [
    {
      "gap_id": "gap-tm-course-risk-101-IALA-G1151-3.2-org-alpha",
      "clause_id": "IALA-G1151-3.2",
      "reporter_org": "org-alpha",
      "country_code": "CN",
      "category": "training_material",
      "title": "课程《航标风险管理基础》译文版本落后",
      "description": "课程 course-risk-101（2023版）依据译文 V1 编写，现行官方译文已更新至 V2；旧版资料不改写，需按新译文组织复训。",
      "service_impact": "术语讲解与现行标准不一致，延续培训后的操作分歧",
      "sensitive": false,
      "status": "open",
      "evidence": [],
      "peer_reviews": [],
      "history": [
        {
          "date": "2026-04-01",
          "actor": "org-alpha",
          "action": "reported",
          "detail": "差距登记"
        },
        {
          "date": "2026-08-01",
          "actor": "joint-project-office",
          "action": "rule_update_evaluated",
          "detail": "规则 CN-海标-2024-07 更新：复评结论未确认符合"
        }
      ],
      "training_material": {
        "course_id": "course-risk-101",
        "edition": "2023版",
        "translation_version": "V1",
        "retrain_required": true,
        "material_content_immutable": true
      },
      "national_rule_id": "CN-海标-2024-07"
    },
    {
      "gap_id": "gap-tm-course-risk-101-IALA-G1151-3.2-org-beta",
      "clause_id": "IALA-G1151-3.2",
      "reporter_org": "org-beta",
      "country_code": "CN",
      "category": "training_material",
      "title": "课程《航标风险管理基础》译文版本落后",
      "description": "课程 course-risk-101（2023版）依据译文 V1 编写，现行官方译文已更新至 V2；旧版资料不改写，需按新译文组织复训。",
      "service_impact": "术语讲解与现行标准不一致，延续培训后的操作分歧",
      "sensitive": false,
      "status": "open",
      "evidence": [],
      "peer_reviews": [],
      "history": [
        {
          "date": "2026-04-01",
          "actor": "org-beta",
          "action": "reported",
          "detail": "差距登记"
        }
      ],
      "training_material": {
        "course_id": "course-risk-101",
        "edition": "2023版",
        "translation_version": "V1",
        "retrain_required": true,
        "material_content_immutable": true
      }
    },
    {
      "gap_id": "gap-tm-course-risk-101-IALA-G1151-3.2-org-gamma",
      "clause_id": "IALA-G1151-3.2",
      "reporter_org": "org-gamma",
      "country_code": "XY",
      "category": "training_material",
      "title": "课程《航标风险管理基础》译文版本落后",
      "description": "课程 course-risk-101（2023版）依据译文 V1 编写，现行官方译文已更新至 V2；旧版资料不改写，需按新译文组织复训。",
      "service_impact": "术语讲解与现行标准不一致，延续培训后的操作分歧",
      "sensitive": false,
      "status": "open",
      "evidence": [],
      "peer_reviews": [],
      "history": [
        {
          "date": "2026-04-01",
          "actor": "org-gamma",
          "action": "reported",
          "detail": "差距登记"
        }
      ],
      "training_material": {
        "course_id": "course-risk-101",
        "edition": "2023版",
        "translation_version": "V1",
        "retrain_required": true,
        "material_content_immutable": true
      }
    },
    {
      "gap_id": "gap-scenario-001-org-gamma-terminology",
      "clause_id": "IALA-G1151-5.3",
      "reporter_org": "org-gamma",
      "country_code": "XY",
      "category": "terminology",
      "title": "风险术语与标准不一致：浓雾夜航期间进口浮标失效",
      "description": "对照风险场景 scenario-001 自评发现：现场通报仍使用“风险概率”，未使用“剩余风险等级”",
      "service_impact": "跨国联合演练中升级判定口径不一致，临时警戒启动偏晚",
      "sensitive": false,
      "status": "closed",
      "evidence": [
        {
          "type": "document",
          "ref": "SOP-GAMMA-2026-018",
          "summary": "修订后的通报模板与复训签到记录",
          "added_by": "org-gamma",
          "date": "2026-06-21"
        }
      ],
      "peer_reviews": [
        {
          "reviewer_org": "org-alpha",
          "date": "2026-05-20",
          "verdict": "agree",
          "comments": "确认术语差异影响联合演练升级判定，建议同步修订通报模板"
        }
      ],
      "history": [
        {
          "date": "2026-05-10",
          "actor": "org-gamma",
          "action": "reported",
          "detail": "差距登记"
        },
        {
          "date": "2026-05-15",
          "actor": "org-gamma",
          "action": "self_assessment",
          "detail": "自评结论：不符合"
        },
        {
          "date": "2026-05-20",
          "actor": "org-alpha",
          "action": "peer_review",
          "detail": "同行复核结论：agree"
        },
        {
          "date": "2026-05-25",
          "actor": "org-gamma",
          "action": "action_planned",
          "detail": "期限 2026-07-31"
        },
        {
          "date": "2026-07-25",
          "actor": "联合项目办公室 王专员",
          "action": "action_extended",
          "detail": "延期至 2026-08-31：复训需避让当地伏休监管任务期"
        },
        {
          "date": "2026-06-01",
          "actor": "org-gamma",
          "action": "action_started",
          "detail": ""
        },
        {
          "date": "2026-06-20",
          "actor": "org-gamma",
          "action": "action_completed",
          "detail": "新通报模板发布，两轮专项复训共 38 人完成"
        },
        {
          "date": "2026-06-21",
          "actor": "org-gamma",
          "action": "evidence_added",
          "detail": "补充证据：document"
        },
        {
          "date": "2026-06-25",
          "actor": "org-gamma",
          "action": "drill_recorded",
          "detail": "演练 drill-2026-06-gamma 结论：pass"
        },
        {
          "date": "2026-06-26",
          "actor": "joint-project-office",
          "action": "closed",
          "detail": "差距经演练核对后关闭"
        }
      ],
      "term_diff": {
        "current": "风险概率",
        "standard": "剩余风险等级"
      },
      "self_assessment": {
        "org_id": "org-gamma",
        "date": "2026-05-15",
        "capability_level": "部分具备",
        "standard_requirement": "统一使用剩余风险等级",
        "conformance": "不符合",
        "notes": "旧版课程用词尚未更新"
      },
      "action": {
        "description": "修订现场通报模板并组织术语专项复训",
        "owner_org": "org-gamma",
        "due_date": "2026-07-31",
        "extensions": [
          {
            "new_due_date": "2026-08-31",
            "reason": "复训需避让当地伏休监管任务期",
            "approver": "联合项目办公室 王专员",
            "date": "2026-07-25"
          }
        ],
        "completed_date": "2026-06-20",
        "resolution_summary": "新通报模板发布，两轮专项复训共 38 人完成"
      },
      "drill_id": "drill-2026-06-gamma",
      "closed": {
        "by": "joint-project-office",
        "date": "2026-06-26"
      }
    },
    {
      "gap_id": "gap-scenario-001-org-gamma-process",
      "clause_id": "IALA-G1151-5.3",
      "reporter_org": "org-gamma",
      "country_code": "XY",
      "category": "process",
      "title": "处置流程与标准不一致：浓雾夜航期间进口浮标失效",
      "description": "对照风险场景 scenario-001 自评发现：处置流程缺少“临时警戒”步骤",
      "service_impact": "标志恢复前缺乏过渡性交通组织措施",
      "sensitive": false,
      "status": "self_assessed",
      "evidence": [],
      "peer_reviews": [],
      "history": [
        {
          "date": "2026-05-10",
          "actor": "org-gamma",
          "action": "reported",
          "detail": "差距登记"
        },
        {
          "date": "2026-05-15",
          "actor": "org-gamma",
          "action": "self_assessment",
          "detail": "自评结论：不符合"
        }
      ],
      "current_process": "确认失效 → 布设标志 → 发布警告 → 复盘",
      "self_assessment": {
        "org_id": "org-gamma",
        "date": "2026-05-15",
        "capability_level": "部分具备",
        "standard_requirement": "先临时警戒再恢复标志",
        "conformance": "不符合",
        "notes": "拟结合处置手册修订补充该步骤"
      }
    },
    {
      "gap_id": "gap-scenario-001-org-gamma-equipment",
      "clause_id": "IALA-G1151-5.3",
      "reporter_org": "org-gamma",
      "country_code": "XY",
      "category": "equipment",
      "title": "设备能力不满足场景要求：浓雾夜航期间进口浮标失效",
      "description": "对照风险场景 scenario-001 自评发现：无快速布设艇与备用灯浮，实际恢复约 12 小时",
      "service_impact": "浓雾夜航时导助航中断窗口远超标准时限",